{
  "artifact_hashes": {
    "formal_config": "01addb00783ab0a5b70d925ff88b3acc587c5d443f4bd449be3fad94c391a967",
    "formal_miter": "cb2453026623d5754b888ea4acb2e535ed982a42bd93254cf20a5fd5b83a60e9",
    "proof_plan": "8ecb2f47dd2e013ac4fdc6554cbb2b8ff3b2054affcf121d63d96ccf0b66cf95"
  },
  "display_name": "verilog-axis two-stage skid pipeline alternative",
  "document_type": "rtl-advisor.variant-manifest",
  "expected_relation": "equivalent",
  "origin": {
    "description": "Compares the pinned upstream one-stage simple-buffer configuration with its two-stage skid-buffer configuration.",
    "generator": null,
    "generator_version": null,
    "kind": "upstream_parameter"
  },
  "parent_reference_id": "verilog-axis-axis-pipeline-register",
  "proof_contract": {
    "assumptions": [
      "both implementations receive the same three arbitrary tagged transactions",
      "each implementation holds a transaction until its own input handshake completes",
      "the shared output sink stalls for no more than two consecutive cycles",
      "disabled AXI sideband outputs are outside the comparison"
    ],
    "kind": "bounded ready-valid transaction equivalence",
    "latency_relation": "transaction_ordered",
    "level": "P3",
    "observables": [
      "accepted output transaction count",
      "accepted output data sequence",
      "bounded completion after the final input"
    ],
    "schema": "rtl-advisor-proof-v1"
  },
  "schema": "rtl-advisor-variant-v1",
  "schema_version": 1,
  "semantic_hash": "cb1c281737f8c743939feb53843f740d40cfe01ca1c48e7cd7749955e8753191",
  "source_changes": [],
  "source_locations": [
    "corpus/upstream/verilog-axis/rtl/axis_pipeline_register.v",
    "corpus/upstream/verilog-axis/rtl/axis_register.v"
  ],
  "state": "prepared",
  "variant_id": "verilog-axis-pipeline-two-stage-skid",
  "variant_lineage_id": "verilog-axis-pipeline-two-stage-skid-v1"
}
